{
 "$schema": "https://json-schema.org/draft/2020-12/schema",
 "properties": {
  "compromised": {
   "items": {
    "properties": {
     "basis": {
      "type": "string"
     },
     "claim": {
      "type": "string"
     },
     "sources": {
      "type": "array"
     },
     "status": {
      "type": "string"
     }
    },
    "required": [
     "basis",
     "claim",
     "sources",
     "status"
    ],
    "type": "object"
   },
   "type": "array"
  },
  "note": {
   "type": "string"
  },
  "offline": {
   "items": {
    "properties": {
     "country": {
      "type": "string"
     },
     "said_by": {
      "type": "string"
     },
     "sources": {
      "type": "array"
     },
     "status": {
      "type": "string"
     },
     "what": {
      "type": "string"
     },
     "when": {
      "type": "string"
     },
     "who": {
      "type": "string"
     }
    },
    "required": [
     "country",
     "said_by",
     "sources",
     "status",
     "what",
     "when",
     "who"
    ],
    "type": "object"
   },
   "type": "array"
  },
  "sources": {
   "items": {
    "type": "string"
   },
   "type": "array"
  }
 },
 "required": [
  "compromised",
  "note",
  "offline",
  "sources"
 ],
 "title": "impact.json",
 "type": "object"
}
