{
 "note": "Two ledgers. The first is systems taken offline, which is a decision an operator makes and can confirm; the second is systems compromised, which only evidence can establish. The columns say whether the entry comes from the organisation itself or from the press, because the difference is the whole point.",
 "offline": [
  {
   "who": "NCSC.nl (the Dutch national cyber security centre's own site)",
   "country": "NL",
   "what": "NCSC.nl taken offline 'uit voorzorg' (as a precaution), with no active misuse seen yet, says the government; DigiD and MijnOverheid also offline, says the Dutch press",
   "when": "2026-10-21",
   "said_by": "the Dutch government (NCSC.nl); TPO.NL (DigiD, MijnOverheid)",
   "status": "reported",
   "sources": [
    "rijksoverheid-ncsc-php-news",
    "tpo-nl-digid-offline"
   ]
  },
  {
   "who": "Finland's government public web services (Valtori)",
   "country": "FI",
   "what": "Incoming public traffic restricted from 12:45 local (09:45 UTC); described as preventive, not a response to a breach; internal networks unaffected",
   "when": "2026-10-21T09:45Z",
   "said_by": "Yle and Helsinki Times quoting Valtori and the National Cyber Security Centre Finland",
   "status": "reported",
   "sources": [
    "yle-finland-government-sites-shut",
    "helsinkitimes-finland-shutdown"
   ]
  },
  {
   "who": "Latvia: several state digital resources, lsm.lv, 112.lv",
   "country": "LV",
   "what": "Access restricted from abroad; state website platform patched by 20:00 UTC; lsm.lv and 112.lv restored; restrictions on others possibly until 26 October",
   "when": "2026-10-21T15:25Z",
   "said_by": "CERT.LV itself",
   "status": "confirmed",
   "sources": [
    "certlv-php-preventive"
   ]
  },
  {
   "who": "Wikimedia Foundation: 'a number of other systems'",
   "country": "US",
   "what": "'taken down a number of other systems as a precautionary measure until they can be safely patched'; parts of Wikipedia affected",
   "when": "2026-10-21",
   "said_by": "the Foundation, as quoted by CNN and The Cyber Express; the BBC",
   "status": "reported",
   "sources": [
    "cnn-php2shell-websites-shut",
    "cyberexpress-php2shell-gov-sites",
    "bbc-live-ckgel5xp2xv9t"
   ]
  },
  {
   "who": "Weird Gloop (RuneScape and other game wikis, about 500 million page views a month)",
   "country": "UK",
   "what": "Web servers off for 13 hours, 'the longest outage we've ever had'; about 94% of page views still served from cache",
   "when": "2026-10-21",
   "said_by": "Weird Gloop itself",
   "status": "confirmed",
   "sources": [
    "weirdgloop-blog-php2shell"
   ]
  },
  {
   "who": "City of Edinburgh Council",
   "country": "UK",
   "what": "Website offline from late Wednesday afternoon; the council says 'essential maintenance' and is 'waiting on an update from our provider'; it has not confirmed a link",
   "when": "2026-10-21",
   "said_by": "The Scotsman quoting a council spokesperson",
   "status": "reported",
   "sources": [
    "scotsman-edinburgh-council-offline"
   ]
  },
  {
   "who": "Oxford City Council and Oxfordshire County Council",
   "country": "UK",
   "what": "Sites removed from service; the city council's post: 'a precaution because of a worldwide issue with the underlying technology and is not a cyber incident'",
   "when": "2026-10-21",
   "said_by": "Oxford Chronicle quoting the councils' social posts",
   "status": "reported",
   "sources": [
    "oxfordchronicle-councils-offline"
   ]
  },
  {
   "who": "Metropolitan Police, Office for Budget Responsibility; errors on Bristol, Lambeth and Barnet council sites",
   "country": "UK",
   "what": "Reported unavailable; a minister said there was no breach of Budget security",
   "when": "2026-10-21",
   "said_by": "LBC, Insurance Business, East Anglian Daily Times",
   "status": "reported",
   "sources": [
    "lbc-uk-websites-offline",
    "insurancebusiness-uk-councils-met",
    "eadt-minister-budget-no-breach"
   ]
  },
  {
   "who": "French government services; the University of Geneva; the BBC; online shops",
   "country": "FR, CH, UK",
   "what": "Listed by the BBC as affected or taken offline",
   "when": "2026-10-22",
   "said_by": "BBC News",
   "status": "reported",
   "sources": [
    "bbc-live-ckgel5xp2xv9t"
   ]
  },
  {
   "who": "Government sites in the Netherlands, France, Germany and Belgium",
   "country": "EU",
   "what": "Listed by Reuters' factbox as having taken sites offline",
   "when": "2026-10-21",
   "said_by": "Reuters, via Global Banking and Finance",
   "status": "reported",
   "sources": [
    "reuters-factbox-websites-offline"
   ]
  },
  {
   "who": "Germany: the City of Mainz's website; the Charité (website and online booking), Vivantes, MHH Hannover and other hospitals; the host Mittwald (all customer websites)",
   "country": "DE",
   "what": "Taken offline on 21 October. The Charité's spokesman: it had \"keinerlei Einfluss auf die Arbeit der Charité\" (no effect on the Charité's work), and its main site was back that evening. Mittwald: every customer website offline from the afternoon, patches going in from 21:28, first checks with no sign of exploitation.",
   "when": "2026-10-21",
   "said_by": "Bitpage.de's situation report, quoting the organisations",
   "status": "reported",
   "sources": [
    "bitpage-php2shell-php-sicherheitsluecke-webseite"
   ]
  },
  {
   "who": "Morocco: the Maghreb Arabe Presse (MAP) and Bank Al-Maghrib websites",
   "country": "MA",
   "what": "MAP's site put into maintenance; Bank Al-Maghrib's unavailable for part of the night",
   "when": "2026-10-21",
   "said_by": "Journal du Canada",
   "status": "reported",
   "sources": [
    "journalducanada-php2shell-des-serveurs-exposes-a-une-cyb"
   ]
  },
  {
   "who": "Romania: the Romanian Police website",
   "country": "RO",
   "what": "Replaced with a maintenance page",
   "when": "2026-10-21",
   "said_by": "Critic Arad",
   "status": "reported",
   "sources": [
    "criticarad-php2shell-cve-2026-109618-ghid-patch"
   ]
  },
  {
   "who": "Japan: a bank's online services; Prime Minister Takaichi's website",
   "country": "JP",
   "what": "Companies and organisations took precautionary measures; a bank suspended its online service for a time, and the Prime Minister's website was also stopped \"for countermeasures\" (対策のため)",
   "when": "2026-10-22",
   "said_by": "Jiji Press, as illustrated by Yahoo! News Japan",
   "status": "reported",
   "sources": [
    "news-yahoo-articles-d953e2a13109253ae974bf2a64ebe94"
   ]
  },
  {
   "who": "Switzerland: the EPFL, the Basel-Stadt administration, the University of Geneva, the insurer La Mobilière",
   "country": "CH",
   "what": "Websites temporarily unavailable from 21 October, 'according to several media'; La Mobilière says it suspended access to its site itself; Basel-Stadt took servers and services offline to patch",
   "when": "2026-10-21",
   "said_by": "24 Heures",
   "status": "reported",
   "sources": [
    "24heures-php2shell-qui-est-affecte-par-la-faille"
   ]
  },
  {
   "who": "Japan: Shizuoka Bank (website and banking app)",
   "country": "JP",
   "what": "Announced a precautionary, temporary shutdown of its website and banking app over the PHP flaws; a precaution, not a compromise",
   "when": "2026-10-22",
   "said_by": "IT Finanzmagazin; The Next Web, citing Bloomberg",
   "status": "reported",
   "sources": [
    "it-finanzmagazin-php2shell-sicherheitsluecken-bedrohen-we",
    "the-next-web-php2shell-no-confirmed-breaches"
   ]
  },
  {
   "who": "Nepal: government portals, the Nepal Rastra Bank's website and web services, the Department of Revenue Investigation's freight-tracking system",
   "country": "NP",
   "what": "Taken offline or suspended as a precaution over the PHP flaws; the Department said it suspended its service because of the risk of exploitation; restoration in stages after patching and testing. The page's headline says 'thousands' of websites but gives no count",
   "when": "2026-10-25",
   "said_by": "The Kathmandu Post",
   "status": "reported",
   "sources": [
    "kathmandupost-science-technology-2026-10-25-php2shell"
   ]
  },
  {
   "who": "Italy: GARR, the research and education network (some of its platforms)",
   "country": "IT",
   "what": "GARR announced on 21 October that it had isolated some of its platforms to apply the fixes, as a precaution against remote access; patching and a gradual restoration of services followed. As Macitynet reports GARR's notice",
   "when": "2026-10-21",
   "said_by": "Macitynet, relaying GARR's notice",
   "status": "reported",
   "sources": [
    "macitynet-php2shell-vulnerabilita-php-siti-offline"
   ]
  }
 ],
 "compromised": [
  {
   "claim": "Amazon: 'PHP2Shell is now being broadly exploited in the wild'",
   "basis": "MadPot honeypot telemetry: an attempt on 17 October, proof-of-concept attempts from 02:00 UTC on 21 October, use against sensors 'almost immediately' after release. 'It's unclear if any of these attempts would have succeeded in real-world systems.'",
   "status": "reported (primary party); attempts against sensors, not victims",
   "sources": [
    "aws-security-blog-madpot"
   ]
  },
  {
   "claim": "Cloudflare: thousands of attempts in the ten hours before announcement, tens of thousands within 45 minutes after, hundreds of thousands within two hours, 'millions now'",
   "basis": "Matthew Prince on X, 22 October 01:25 UTC; attempts seen at the edge, not compromises; no blocked count published",
   "status": "reported (primary party)",
   "sources": [
    "x-eastdakota-php2shell-stats",
    "cloudflare-blog-php2shell-waf"
   ]
  },
  {
   "claim": "Imperva: no traffic matching the exploit patterns during pre-disclosure monitoring",
   "basis": "Imperva had the details under embargo and monitored customer traffic before the announcement",
   "status": "reported (primary party); a negative finding",
   "sources": [
    "imperva-blog-php2shell"
   ]
  },
  {